{
  "body_representations": [
    {
      "bytes_per_coordinate": 1,
      "id": "raw_rgb_uint8"
    },
    {
      "bytes_per_coordinate": 4,
      "id": "caseii_int32_le"
    }
  ],
  "expected_counts": {
    "round_trip_cases_across_two_executions": 96,
    "round_trip_cases_per_execution": 48,
    "timing_aggregate_rows_per_execution": 48,
    "timing_records_per_execution": 1440
  },
  "image_ids": [
    "astronaut",
    "retina",
    "syn_checker",
    "syn_lowrank"
  ],
  "master_key_hex": "00112233445566778899aabbccddeeff102132435465768798a9bacbdcedfe0f",
  "master_seed": 20260807,
  "primitives": [
    {
      "id": "AES-256-GCM",
      "implementation": "cryptography.AESGCM",
      "nonce_bytes": 12
    },
    {
      "id": "SHAKE-256/HMAC-SHA-256",
      "implementation": "qsa_benchmark keyed SHAKE and HMAC",
      "nonce_bytes": 16
    }
  ],
  "protocol_id": "QSA-PRIMITIVE-SCALING-V1",
  "schema_version": 1,
  "sizes": [
    96,
    256,
    512
  ],
  "timing_repetitions": 15
}
